{
  "schema_version": "1.1",
  "project": {
    "name": "案例D",
    "renewal_type": "danger_building"
  },
  "land": {
    "site_area_sqm": 1500.0,
    "plaza_area_sqm": 0.0,
    "far": 2.4,
    "bonus_ratio": 0.4,
    "bonus_breakdown": {
      "時程": 0.3,
      "規模": 0.08,
      "基本": 0.02
    },
    "tdr_transfer_sqm": 1080.0
  },
  "building": {
    "public_ratio": 0.34,
    "stair_hall_exempt_pct": 5,
    "balcony_exempt_pct": 10,
    "unit_count": 48
  },
  "owners": [],
  "finance": {
    "residential_price": 65.0,
    "shop_area": 90.0,
    "shop_price": 100.0,
    "parking_count": 78,
    "parking_price": 230.0,
    "construction_price": 20.0
  },
  "result": {
    "baseline_far": 3600.0,
    "allow_floor_area": 6120.0,
    "used_floor_area": 6157.5,
    "remaining_floor_area": -37.5,
    "stair_exempt_cap": 918.0,
    "balcony_exempt_area": 693.0,
    "saleable_area": 3153.84,
    "efficiency_ratio": 1.704,
    "total_sales": 226089.0,
    "shared_cost": 149230.0,
    "shared_cost_ratio": 0.66,
    "owner_return_value": 76860.0,
    "owner_return_ratio": 0.34,
    "return_rate": 0.515,
    "pre_renewal_value": 36300.0,
    "value_multiple": 2.12,
    "warnings": [
      {
        "code": "EFFICIENCY_OUT_OF_BAND",
        "level": "warn",
        "message": "銷坪比 1.704 不在正常帶 1.58–1.68",
        "field": "efficiency_ratio"
      },
      {
        "code": "VOLUME_EXCEEDED",
        "level": "error",
        "message": "容積超出允建 37.50 m²，需調整設計",
        "field": "remaining_floor_area"
      },
      {
        "code": "SHARED_COST_HIGH",
        "level": "error",
        "message": "共負比 66.0% 超過警示線 60%，地主接受度明顯降低",
        "field": "shared_cost_ratio"
      }
    ],
    "computed_at": "2026-07-01T00:00:00+00:00",
    "core_version": "0.2.0"
  }
}